{
    "schema_version":  "1.0.0",
    "id":  "warn.duplicate.quoted_bare_newline.010",
    "category":  "warn",
    "description":  "Duplicate key across bare and quoted forms warns.",
    "input":  "k: 1\n\"k\": 2",
    "expect":  {
                   "status":  "ok_with_warnings",
                   "output_json":  "{\"k\":2}",
                   "warnings":  [
                                    {
                                        "code":  "CCML2001",
                                        "severity":  "warning",
                                        "message_contains":  "duplicate key"
                                    }
                                ]
               }
}
