{
  "schema_version": "1.0.0",
  "id": "valid.basic_object.001",
  "category": "valid",
  "description": "Implicit root object with bare keys and primitive values.",
  "input": "name: \"Alice\"\nage: 30\nactive: true",
  "expect": {
    "status": "ok",
    "output_json": "{\"name\":\"Alice\",\"age\":30,\"active\":true}"
  }
}
